{
  "schema_version": "1.0.0",
  "dataset_id": "popio-vet-access",
  "generated_at": "2026-08-24T22:30:00+09:00",
  "timezone": "Asia/Tokyo",
  "routing_origin": {
    "label": "川崎市宮前区神木本町2丁目（代表地点）",
    "precision": "neighborhood_representative",
    "privacy_note": "自宅の正確な住所は保存せず、町丁目代表地点を経路比較に使用した。"
  },
  "coordinate_source": {
    "provider": "国土地理院 住所検索",
    "url": "https://msearch.gsi.go.jp/address-search/AddressSearch",
    "checked_at": "2026-08-24",
    "precision_note": "住所文字列から得た街区相当の代表座標。病院入口や駐車場入口を保証しない。"
  },
  "hospitals": [
    {
      "hospital_id": "uehara",
      "name": "上原どうぶつ病院",
      "roles": ["general_candidate"],
      "address": "神奈川県川崎市宮前区菅生3-1-14",
      "latitude": 35.596058,
      "longitude": 139.553101,
      "coordinate_precision": "block_level",
      "phone": "044-978-5260",
      "alternate_phone": null,
      "website_url": null,
      "google_maps_url": "https://www.google.com/maps/search/?api=1&query=35.596058%2C139.553101",
      "ipet_supported": true,
      "ipet_note": "iPet公式の宮前区検索に掲載。",
      "distance": { "value": 3.4, "unit": "km", "method": "google_maps_driving_route", "measured_at": "2026-08-24" },
      "travel_time": { "value": 11, "unit": "minute", "method": "google_maps_driving_route", "traffic_note": "確認時点の表示。交通状況で変動する。", "measured_at": "2026-08-24" },
      "parking": { "available": true, "spaces": 1, "note": "川崎市獣医師会掲載。" },
      "opening_hours": { "display": "10:00–12:00、午後は16:00–19:00または21:00。木休、日祝午前", "structured_status": "conflicting", "note": "iPetは午後19時まで、川崎市獣医師会は21時まで。受診前の電話確認が必要。" },
      "holidays": "日曜・祝日は午前診療の掲載あり。",
      "access": { "saturday": true, "sunday": true, "public_holiday": true, "web_reservation": null, "same_day": null, "reservation_note": "予約方法は公開情報で確認できず。" },
      "emergency": null,
      "night_service": { "available": null, "display": "不明", "admission": null, "call_first": null },
      "medical": {
        "veterinarian_count": null,
        "veterinarian_count_note": "不明",
        "specialties": [],
        "hospitalization": null,
        "surgery": null,
        "xray": null,
        "ultrasound": null,
        "ct": null,
        "mri": null,
        "orthopedics": null,
        "neurology": null,
        "ivdd": null,
        "rehabilitation": null,
        "puppy_care": null,
        "vaccination": true,
        "neutering": null,
        "referral": { "officially_stated": null, "destinations": [], "note": "Google公開レビューには対応限界を説明して高度施設を案内したとの投稿があるが、公式記載ではない。" },
        "note": "公式サイトを確認できず、設備・専門性は不明。"
      },
      "google_rating": 4.3,
      "google_review_count": 14,
      "caloo_rating": 3.62,
      "caloo_review_count": 2,
      "review_sources": [
        { "source": "Google Maps", "rating": 4.3, "review_count": 14, "url": "https://www.google.com/maps/search/?api=1&query=35.596058%2C139.553101", "checked_at": "2026-08-24", "status": "verified", "note": "公開表示値。" },
        { "source": "Calooペット", "rating": 3.62, "review_count": 2, "url": "https://pet.caloo.jp/hospitals/search/14136/all/all", "checked_at": "2026-08-24", "status": "verified", "note": "宮前区一覧の表示値。" }
      ],
      "reputation_summary": "件数が少なく判断幅が大きい。診療・手術・紹介説明への肯定が見えるが、複数ソースでの十分な再現性はない。",
      "positive_signals": [
        { "category": "explanation", "signal": "positive", "sources": ["Google Maps"], "replication": "single_source", "assessment": "対応可能範囲を説明し高度施設へつないだという公開投稿。" }
      ],
      "negative_signals": [
        { "category": "owner_handling", "signal": "negative", "sources": ["Google Maps"], "replication": "single_source", "assessment": "古い接遇・相性面の不満が見えるが、医療懸念としては扱わない。" }
      ],
      "local_signals": [],
      "home_doctor_score": 67,
      "emergency_score": 42,
      "dachshund_score": 25,
      "medical_capability_score": 40,
      "accessibility_score": 83,
      "overall_reference_score": 49,
      "confidence": 42,
      "score_note": "設備・獣医師数・専門性の未知項目が多いため能力スコアを抑制。",
      "uncertainties": ["午後診療の終了時刻", "設備", "獣医師数", "時間外対応"],
      "last_verified_at": "2026-08-24T22:30:00+09:00",
      "source_urls": [
        { "url": "https://www.ipetclub.jp/vh/hospital/?a%5B%5D=02&m%5B%5D=141364&p%5B%5D=14&s=area&v=1", "source_type": "official_insurer", "checked_at": "2026-08-24", "supports": ["iPet", "address", "phone", "hours"] },
        { "url": "https://www.k-vma.com/member-map/uehara/", "source_type": "official_association", "checked_at": "2026-08-24", "supports": ["hours", "parking"], "note": "iPetと午後終了時刻が矛盾。" },
        { "url": "https://www.google.com/maps/search/?api=1&query=35.596058%2C139.553101", "source_type": "google_maps", "checked_at": "2026-08-24", "supports": ["route", "rating", "review_count"] }
      ]
    },
    {
      "hospital_id": "takada",
      "name": "タカダ動物病院",
      "roles": ["home_doctor", "holiday_backup"],
      "address": "神奈川県川崎市宮前区馬絹2-5-2",
      "latitude": 35.581768,
      "longitude": 139.594971,
      "coordinate_precision": "block_level",
      "phone": "044-852-6446",
      "alternate_phone": null,
      "website_url": null,
      "google_maps_url": "https://www.google.com/maps/search/?api=1&query=35.581768%2C139.594971",
      "ipet_supported": true,
      "ipet_note": "iPet公式の宮前区検索に掲載。",
      "distance": { "value": 3.3, "unit": "km", "method": "google_maps_driving_route", "measured_at": "2026-08-24" },
      "travel_time": { "value": 10, "unit": "minute", "method": "google_maps_driving_route", "traffic_note": "確認時点の表示。", "measured_at": "2026-08-24" },
      "parking": { "available": null, "spaces": null, "note": "第三者サイトには駐車場表示があるが、公式根拠を確認できず。" },
      "opening_hours": { "display": "月・水〜日祝9:00–12:00、月・水〜土祝16:00–20:00。火休", "structured_status": "verified_current", "note": "iPet公式掲載。" },
      "holidays": "火曜を除き祝日診療の掲載あり。",
      "access": { "saturday": true, "sunday": true, "public_holiday": true, "web_reservation": false, "same_day": true, "reservation_note": "電話予約。公開レビューに休診中のかかりつけから当日受入された例あり。" },
      "emergency": true,
      "night_service": { "available": null, "display": "第三者サイトに時間外は電話相談の記載。常時受入は未確認。", "admission": null, "call_first": true },
      "medical": {
        "veterinarian_count": null,
        "veterinarian_count_note": "不明",
        "specialties": [],
        "hospitalization": null,
        "surgery": true,
        "xray": null,
        "ultrasound": null,
        "ct": null,
        "mri": null,
        "orthopedics": null,
        "neurology": null,
        "ivdd": null,
        "rehabilitation": null,
        "puppy_care": true,
        "vaccination": true,
        "neutering": true,
        "referral": { "officially_stated": null, "destinations": [], "note": "不明" },
        "note": "公式サイトを確認できず、設備は不明。手術は口コミでの受診経験に基づくため、術式範囲は未確認。"
      },
      "google_rating": 4.2,
      "google_review_count": 30,
      "caloo_rating": 4.24,
      "caloo_review_count": 3,
      "review_sources": [
        { "source": "Google Maps", "rating": 4.2, "review_count": 30, "url": "https://www.google.com/maps/search/?api=1&query=35.581768%2C139.594971", "checked_at": "2026-08-24", "status": "verified", "note": "公開表示値。" },
        { "source": "Calooペット", "rating": 4.24, "review_count": 3, "url": "https://pet.caloo.jp/hospitals/search/14136/all/all", "checked_at": "2026-08-24", "status": "verified", "note": "宮前区一覧の表示値。" }
      ],
      "reputation_summary": "急な受入、長期通院、手術、丁寧な診察の肯定がある。待ち時間は運用面の注意。Caloo件数は少ない。",
      "positive_signals": [
        { "category": "emergency", "signal": "positive", "sources": ["Google Maps"], "replication": "single_source", "assessment": "休診中のかかりつけに代わり当日受入したとの最近の投稿。" },
        { "category": "explanation", "signal": "positive", "sources": ["Google Maps", "Calooペット"], "replication": "cross_source", "assessment": "丁寧な診察・説明の傾向。" }
      ],
      "negative_signals": [
        { "category": "waiting", "signal": "negative", "sources": ["Calooペット"], "replication": "single_source", "assessment": "丁寧さと引き換えに待ち時間が長いとの指摘。" }
      ],
      "local_signals": [],
      "home_doctor_score": 75,
      "emergency_score": 65,
      "dachshund_score": 30,
      "medical_capability_score": 45,
      "accessibility_score": 82,
      "overall_reference_score": 58,
      "confidence": 58,
      "score_note": "休日と当日対応を評価。時間外常時受入・設備は未確認。",
      "uncertainties": ["駐車場の公式確認", "設備", "時間外受入条件", "紹介先"],
      "last_verified_at": "2026-08-24T22:30:00+09:00",
      "source_urls": [
        { "url": "https://www.ipetclub.jp/vh/hospital/?a%5B%5D=02&m%5B%5D=141364&p%5B%5D=14&s=area&v=1", "source_type": "official_insurer", "checked_at": "2026-08-24", "supports": ["iPet", "address", "phone", "hours"] },
        { "url": "https://www.y-petnavi.jp/pet/takadadoubutubyouin/", "source_type": "directory", "checked_at": "2026-08-24", "supports": ["reservation", "after_hours"], "note": "病院公式ではないため補助情報。" },
        { "url": "https://www.google.com/maps/search/?api=1&query=35.581768%2C139.594971", "source_type": "google_maps", "checked_at": "2026-08-24", "supports": ["route", "rating", "review_count"] }
      ]
    },
    {
      "hospital_id": "yuimaru",
      "name": "ゆいまーる動物病院",
      "roles": ["general_candidate"],
      "address": "神奈川県川崎市宮前区東有馬3-5-28",
      "latitude": 35.57233,
      "longitude": 139.586899,
      "coordinate_precision": "block_level",
      "phone": "044-948-5462",
      "alternate_phone": null,
      "website_url": "https://www.yuimaruah.jp/",
      "google_maps_url": "https://www.google.com/maps/search/?api=1&query=35.572330%2C139.586899",
      "ipet_supported": true,
      "ipet_note": "公式サイトとiPet公式掲載で確認。",
      "distance": { "value": 5.7, "unit": "km", "method": "google_maps_driving_route", "measured_at": "2026-08-24" },
      "travel_time": { "value": 15, "unit": "minute", "method": "google_maps_driving_route", "traffic_note": "確認時点の表示。", "measured_at": "2026-08-24" },
      "parking": { "available": null, "spaces": null, "note": "不明" },
      "opening_hours": { "display": "9:00–12:00、16:00–19:00。木休、日曜午後休、祝休", "structured_status": "verified_current", "note": "公式サイト確認。" },